<!ELEMENT liga (partido+)>
<!ELEMENT partido (local, visitante)>
<!ELEMENT local (nombre, goles)>
<!ELEMENT visitante (nombre, goles)>
<!ELEMENT nombre (#PCDATA)>
<!ELEMENT goles (#PCDATA)>